$ mysql -u root -p  （有密码时）

$ mysql -u root     （无密码时）

创建一个数据库:create database dbname;
删除一个数据库：drop database dbname; 

创建一个表格: create table tablename(name varchar(20),chengji int);
删除一个表格：drop table tablename;

更改user表格中的小明的成绩：update user set chengji=12 where name='小明'；
删除user表格中名字叫小明的信息：delete from user where name='小明'；

往user表内插入数据：insert into user value('Tom','87987');
查询user表的所有数据：select * from user;

mysql> show databases;  // 查看当前所有的数据库
+--------------------+
| Database           |
+--------------------+
| information_schema |
| csvt               |
| csvt04             |
| mysql              |
| performance_schema |
| test               |
+--------------------+
6 rows in set (0.18 sec)

mysql> use test;   //作用与test数据库
Database changed
mysql> show tables;   //查看test库下面的表
Empty set (0.00 sec)

//创建user表，name 和password 两个字段
mysql> CREATE  TABLE  user (name VARCHAR(20),password VARCHAR(20));  Query OK, 0 rows affected (0.27 sec)

//向user表内插入若干条数据
mysql> insert into user values('Tom','1321');
Query OK, 1 row affected (0.05 sec)

mysql> insert into user values('Alen','7875');
Query OK, 1 row affected (0.08 sec)

mysql> insert into user values('Jack','7455');
Query OK, 1 row affected (0.04 sec)

//查看user表的数据
mysql> select * from user;
+------+----------+
| name | password |
+------+----------+
| Tom  | 1321     |
| Alen | 7875     |
| Jack | 7455     |
+------+----------+
3 rows in set (0.01 sec)

//删除name 等于Jack的数据
mysql> delete from user where name = 'Jack';
Query OK, 1 rows affected (0.06 sec)

//修改name等于Alen 的password 为 1111
mysql> update user set password='1111' where name = 'Alen';
Query OK, 1 row affected (0.05 sec)
Rows matched: 1  Changed: 1  Warnings: 0

//查看表内容
mysql> select * from user;
+--------+----------+
| name   | password |
+--------+----------+
| Tom    | 1321     |
| Alen   | 1111     |
+--------+----------+
3 rows in set (0.00 sec)

修改表结构

1、 ALTER TABLE tab_name ADD PRIMARY KEY (col_name)

说明：更改表得的定义把某个栏位设为主键。

2、ALTER TABLE tab_name DROP PRIMARY KEY (col_name)
说明：把主键的定义删除

3、 alter table tab_name add col_name varchar(20);
//在tab_name表中增加一个名为col_name的字段且类型为varchar(20)

4、alter table tab_name drop
col_name //在tab_name中将col_name字段删除

5、alter table tab_name modify col_name
varchar(40) not null //修改字段属性，注若加上not null则要求原字段下没有数据
SQL
Server200下的写法是：Alter Table table_name Alter Column col_name varchar(30) not null;

6、如何修改表名：alter table tab_name rename to new_tab_name

7、如何修改字段名：alter table tab_name change old_col new_col varchar(40);
//必须为当前字段指定数据类型等属性，否则不能修改
8、create table new_tab_name like old_tab_name
//用一个已存在的表来建新表，但不包含旧表的数据

